{
    "schema": "urn:azguard:bench:result:1",
    "date": "2026-10-09T16:36:01Z",
    "commit": "c04529e8f288",
    "dirty": true,
    "tier": "mini",
    "driver": "sqlite",
    "cache": "array",
    "environment": {
        "php": "8.4.26",
        "laravel": "13.35.0",
        "database": "sqlite",
        "database_server": "3.46.1",
        "opcache": true,
        "xdebug": false,
        "cpu": "Intel(R) Xeon(R) Processor",
        "cpus": 8,
        "os": "Linux 6.12.94+"
    },
    "dataset": {
        "tier": {
            "name": "mini",
            "users": 200,
            "heavy_roles": 20,
            "heavy_direct": 200,
            "posts": 10000,
            "tenants": 20,
            "members_per_tenant": 10,
            "iterations": 200,
            "warmup": 20,
            "ladder": [
                1,
                2,
                4
            ],
            "reps": 3
        },
        "rows": {
            "users": 200,
            "posts": 10000,
            "teams": 20,
            "team_user": 200,
            "azg_role_grants": 509,
            "azg_permission_grants": 220
        },
        "digest": "97bdddcaad4f0b3be0fb6da9c77dc5cee0b639a4d164a88488767425eb08ba4e"
    },
    "profiles": [
        {
            "id": "checks-concurrent",
            "description": "First check of a request, random user and permission, 1..N concurrent workers",
            "primary_op": "check",
            "stages": [
                {
                    "name": "check:w1",
                    "workers": 1,
                    "iterations_per_worker": 200,
                    "warmup_per_worker": 20,
                    "windows_s": [
                        0.893,
                        0.881,
                        0.923
                    ],
                    "reps": [
                        {
                            "check": {
                                "count": 200,
                                "errors": 0,
                                "p50_us": 4444.7,
                                "p95_us": 6099.2,
                                "p99_us": 6802.3,
                                "max_us": 7780.6,
                                "sql_per_op": 3.67,
                                "ops_per_s": 224.1
                            },
                            "probe.snapshot": {
                                "count": 111,
                                "errors": 0,
                                "p50_us": 450.4,
                                "p95_us": 692.8,
                                "p99_us": 805.6,
                                "max_us": 812.7,
                                "sql_per_op": 0,
                                "ops_per_s": 124.4
                            }
                        },
                        {
                            "check": {
                                "count": 200,
                                "errors": 0,
                                "p50_us": 4380.8,
                                "p95_us": 6177.2,
                                "p99_us": 6830.1,
                                "max_us": 15190.3,
                                "sql_per_op": 3.67,
                                "ops_per_s": 227.1
                            },
                            "probe.snapshot": {
                                "count": 111,
                                "errors": 0,
                                "p50_us": 430.8,
                                "p95_us": 636.5,
                                "p99_us": 701.4,
                                "max_us": 702.6,
                                "sql_per_op": 0,
                                "ops_per_s": 126
                            }
                        },
                        {
                            "check": {
                                "count": 200,
                                "errors": 0,
                                "p50_us": 4529.9,
                                "p95_us": 6399.1,
                                "p99_us": 7622.1,
                                "max_us": 8406.5,
                                "sql_per_op": 3.67,
                                "ops_per_s": 216.6
                            },
                            "probe.snapshot": {
                                "count": 111,
                                "errors": 0,
                                "p50_us": 476.4,
                                "p95_us": 674.8,
                                "p99_us": 1053.7,
                                "max_us": 1083.1,
                                "sql_per_op": 0,
                                "ops_per_s": 120.2
                            }
                        }
                    ],
                    "summary": {
                        "check": {
                            "p50_us": 4444.7,
                            "p95_us": 6177.2,
                            "p99_us": 6830.1,
                            "sql_per_op": 3.67,
                            "ops_per_s": 224.1,
                            "errors": 0,
                            "p95_cv": 0.02,
                            "stable": true
                        },
                        "probe.snapshot": {
                            "p50_us": 450.4,
                            "p95_us": 674.8,
                            "p99_us": 805.6,
                            "sql_per_op": 0,
                            "ops_per_s": 124.4,
                            "errors": 0,
                            "p95_cv": 0.035,
                            "stable": true
                        }
                    },
                    "checks": []
                },
                {
                    "name": "check:w2",
                    "workers": 2,
                    "iterations_per_worker": 200,
                    "warmup_per_worker": 20,
                    "windows_s": [
                        1.027,
                        1.142,
                        0.911
                    ],
                    "reps": [
                        {
                            "check": {
                                "count": 400,
                                "errors": 0,
                                "p50_us": 4920.8,
                                "p95_us": 6800.1,
                                "p99_us": 8421.4,
                                "max_us": 9373.5,
                                "sql_per_op": 3.67,
                                "ops_per_s": 389.5
                            },
                            "probe.snapshot": {
                                "count": 222,
                                "errors": 0,
                                "p50_us": 543,
                                "p95_us": 716.4,
                                "p99_us": 993.5,
                                "max_us": 3114.8,
                                "sql_per_op": 0,
                                "ops_per_s": 216.2
                            }
                        },
                        {
                            "check": {
                                "count": 400,
                                "errors": 0,
                                "p50_us": 4873.4,
                                "p95_us": 6568.9,
                                "p99_us": 6825.9,
                                "max_us": 8591.3,
                                "sql_per_op": 3.67,
                                "ops_per_s": 350.1
                            },
                            "probe.snapshot": {
                                "count": 222,
                                "errors": 0,
                                "p50_us": 548.2,
                                "p95_us": 646.4,
                                "p99_us": 793.5,
                                "max_us": 849.1,
                                "sql_per_op": 0,
                                "ops_per_s": 194.3
                            }
                        },
                        {
                            "check": {
                                "count": 400,
                                "errors": 0,
                                "p50_us": 4500.1,
                                "p95_us": 6468.8,
                                "p99_us": 7093.5,
                                "max_us": 16995.3,
                                "sql_per_op": 3.67,
                                "ops_per_s": 439
                            },
                            "probe.snapshot": {
                                "count": 222,
                                "errors": 0,
                                "p50_us": 454.2,
                                "p95_us": 645.1,
                                "p99_us": 897.5,
                                "max_us": 1182,
                                "sql_per_op": 0,
                                "ops_per_s": 243.7
                            }
                        }
                    ],
                    "summary": {
                        "check": {
                            "p50_us": 4873.4,
                            "p95_us": 6568.9,
                            "p99_us": 7093.5,
                            "sql_per_op": 3.67,
                            "ops_per_s": 389.5,
                            "errors": 0,
                            "p95_cv": 0.021,
                            "stable": true
                        },
                        "probe.snapshot": {
                            "p50_us": 543,
                            "p95_us": 646.4,
                            "p99_us": 897.5,
                            "sql_per_op": 0,
                            "ops_per_s": 216.2,
                            "errors": 0,
                            "p95_cv": 0.05,
                            "stable": true
                        }
                    },